<?xml version="1.0" encoding="UTF-8"?>
<CriteriaSet xmlns="http://example.com/rules"
    xmlns:xsi="http://www.w3.org/2001/XMLSchema-instance"
    xsi:schemaLocation="http://example.com/rules test_criteria_2024-01-10.xsd">

    <!--Timestamp: 12 Jan 2024 10:30:45-->

    <Criteria criteriaID="1704925016376" criteriaName="PassengerCarTireCriteria">
        <description>Passenger Car Tire Criteria</description>
        <criteriaValues>
            <CriteriaValue>
                <valueName>TP</valueName>
                <evalItem>
                    <valueRange>
                        <min>31</min>
                        <max>51</max>
                    </valueRange>
                </evalItem>
            </CriteriaValue>
            <CriteriaValue>
                <valueName>Temp</valueName>
                <evalItem>
                    <valueRange>
                        <min>-15</min>
                        <max>120</max>
                    </valueRange>
                </evalItem>
            </CriteriaValue>             
        </criteriaValues>
    </Criteria>

    <Criteria criteriaID="1704925021666" criteriaName="BicycleTireCriteria">
        <description>Bicycle Tire Criteria</description>
        <criteriaValues>
            <CriteriaValue>
                <valueName>TP</valueName>
                <evalItem>
                    <valueRange>
                        <min>40</min>
                        <max>70</max>
                    </valueRange>
                </evalItem>
            </CriteriaValue>
            <CriteriaValue>
                <valueName>Temp</valueName>
                <evalItem>
                    <valueRange>
                        <min>0</min>
                        <max>110</max>
                    </valueRange>
                </evalItem>
            </CriteriaValue>            
        </criteriaValues>
    </Criteria>       

</CriteriaSet>